{
  "type": "topology.changed.v1",
  "timestamp": "2026-01-01T00:00:00.000Z",
  "version": "1.0.0",
  "modules": [
    {
      "id": "gateway",
      "dependsOn": ["orchestrator", "observability"]
    },
    {
      "id": "orchestrator",
      "dependsOn": ["event-bus"]
    },
    {
      "id": "observability",
      "dependsOn": ["event-bus"]
    },
    {
      "id": "event-bus",
      "dependsOn": []
    }
  ]
}
